[
  {
    "id": "modelscope-events-64f836685c29d9e6",
    "source_id": "modelscope-events",
    "title": "AI+♾️ 开发者创作大赛 第二期：用 AI，提前看见未来！",
    "discovered_url": "https://modelscope.cn/events/347/%E6%AF%94%E8%B5%9B%E4%BB%8B%E7%BB%8D",
    "source_tier": "trusted-platform",
    "first_seen": "2026-09-02",
    "last_seen": "2026-09-23",
    "status": "new",
    "match_reason": [
      "title:大赛",
      "url:/events/"
    ]
  },
  {
    "id": "modelscope-events-71e523187a32a8a6",
    "source_id": "modelscope-events",
    "title": "FlagOS开放计算全球挑战赛S2",
    "discovered_url": "https://modelscope.cn/events/342/FlagOS%E5%BC%80%E6%94%BE%E8%AE%A1%E7%AE%97%E5%85%A8%E7%90%83%E6%8C%91%E6%88%98%E8%B5%9BS2",
    "source_tier": "trusted-platform",
    "first_seen": "2026-09-02",
    "last_seen": "2026-10-11",
    "status": "new",
    "match_reason": [
      "title:挑战赛",
      "url:/events/"
    ]
  },
  {
    "id": "modelscope-events-fe95c0e8ef4ff5cf",
    "source_id": "modelscope-events",
    "title": "中客松 ING Hackathon 2026",
    "discovered_url": "https://modelscope.cn/events/352/%E6%AF%94%E8%B5%9B%E4%BB%8B%E7%BB%8D",
    "source_tier": "trusted-platform",
    "first_seen": "2026-09-02",
    "last_seen": "2026-10-08",
    "status": "new",
    "match_reason": [
      "title:Hackathon",
      "url:/events/"
    ]
  },
  {
    "id": "usa-government-challenges-00e2238470d60558",
    "source_id": "usa-government-challenges",
    "title": "NIH Complement Animal Research in Experimentation NAMs Reduction to Practice Challenge",
    "discovered_url": "https://www.usa.gov/challenges/nih-new-approach-methodologies-nams",
    "source_tier": "official-page",
    "first_seen": "2026-09-02",
    "last_seen": "2026-10-11",
    "status": "new",
    "match_reason": [
      "title:challenge",
      "url:challenge"
    ]
  },
  {
    "id": "usa-government-challenges-149fe07abf65c6aa",
    "source_id": "usa-government-challenges",
    "title": "xTech|Kinetic Reach",
    "discovered_url": "https://www.usa.gov/challenges/xtech-kinetic-reach",
    "source_tier": "official-page",
    "first_seen": "2026-09-02",
    "last_seen": "2026-10-11",
    "status": "new",
    "match_reason": [
      "url:challenge"
    ]
  },
  {
    "id": "usa-government-challenges-3619be5b465c04e2",
    "source_id": "usa-government-challenges",
    "title": "One CDC Data Platform (1CDP) Innovation Challenge",
    "discovered_url": "https://www.usa.gov/challenges/1cdp-innovation-challenge",
    "source_tier": "official-page",
    "first_seen": "2026-09-02",
    "last_seen": "2026-10-11",
    "status": "new",
    "match_reason": [
      "title:challenge",
      "url:challenge"
    ]
  },
  {
    "id": "usa-government-challenges-53b8770261d597b1",
    "source_id": "usa-government-challenges",
    "title": "Careers in Your Community Challenge",
    "discovered_url": "https://www.usa.gov/challenges/careers-in-your-community-challenge",
    "source_tier": "official-page",
    "first_seen": "2026-09-02",
    "last_seen": "2026-10-11",
    "status": "new",
    "match_reason": [
      "title:challenge",
      "url:challenge"
    ]
  },
  {
    "id": "usa-government-challenges-59cf9826bf386ed8",
    "source_id": "usa-government-challenges",
    "title": "Halt the Hitchhiker: Invasive Species Challenge",
    "discovered_url": "https://www.usa.gov/challenges/halt-the-hitchhiker-invasive-species",
    "source_tier": "official-page",
    "first_seen": "2026-09-02",
    "last_seen": "2026-10-11",
    "status": "new",
    "match_reason": [
      "title:challenge",
      "url:challenge"
    ]
  },
  {
    "id": "usa-government-challenges-7b73628ed20d17a2",
    "source_id": "usa-government-challenges",
    "title": "Connecting Talent to Opportunity Challenge",
    "discovered_url": "https://www.usa.gov/challenges/cto-challenge",
    "source_tier": "official-page",
    "first_seen": "2026-09-02",
    "last_seen": "2026-10-11",
    "status": "new",
    "match_reason": [
      "title:challenge",
      "url:challenge"
    ]
  },
  {
    "id": "usa-government-challenges-8d6a3d6ea7234c6a",
    "source_id": "usa-government-challenges",
    "title": "Building Disaster-Ready Human Services Systems",
    "discovered_url": "https://www.usa.gov/challenges/disaster-ready-human-services",
    "source_tier": "official-page",
    "first_seen": "2026-09-02",
    "last_seen": "2026-09-08",
    "status": "new",
    "match_reason": [
      "url:challenge"
    ]
  },
  {
    "id": "usa-government-challenges-c2b6257f089c7140",
    "source_id": "usa-government-challenges",
    "title": "xTech|Search 10",
    "discovered_url": "https://www.usa.gov/challenges/xtech-search-10",
    "source_tier": "official-page",
    "first_seen": "2026-09-02",
    "last_seen": "2026-10-11",
    "status": "new",
    "match_reason": [
      "url:challenge"
    ]
  },
  {
    "id": "usa-government-challenges-d30c57dd4ee1ac0b",
    "source_id": "usa-government-challenges",
    "title": "NASA's Gateways to Blue Skies (GBS) Competition",
    "discovered_url": "https://www.usa.gov/challenges/gateways-blue-skies",
    "source_tier": "official-page",
    "first_seen": "2026-09-02",
    "last_seen": "2026-10-11",
    "status": "new",
    "match_reason": [
      "title:competition",
      "url:challenge"
    ]
  },
  {
    "id": "usa-government-challenges-d6731568310c38b8",
    "source_id": "usa-government-challenges",
    "title": "ACL Cultivating Connected Communities Challenge",
    "discovered_url": "https://www.usa.gov/challenges/cultivating-connected-communities",
    "source_tier": "official-page",
    "first_seen": "2026-09-02",
    "last_seen": "2026-10-11",
    "status": "new",
    "match_reason": [
      "title:challenge",
      "url:challenge"
    ]
  },
  {
    "id": "usa-government-challenges-5012cb4a65575263",
    "source_id": "usa-government-challenges",
    "title": "2026-27 NASA TechRise Student Challenge",
    "discovered_url": "https://www.usa.gov/challenges/nasa-techrise-student-challenge",
    "source_tier": "official-page",
    "first_seen": "2026-09-04",
    "last_seen": "2026-10-11",
    "status": "new",
    "match_reason": [
      "title:challenge",
      "url:challenge"
    ]
  },
  {
    "id": "usa-government-challenges-44afedbefe14bd07",
    "source_id": "usa-government-challenges",
    "title": "Ready, Set...ID the Biothreat Challenge",
    "discovered_url": "https://www.usa.gov/challenges/ready-set-id-biothreat",
    "source_tier": "official-page",
    "first_seen": "2026-09-08",
    "last_seen": "2026-10-11",
    "status": "new",
    "match_reason": [
      "title:challenge",
      "url:challenge"
    ]
  },
  {
    "id": "modelscope-events-64deb759d9dc1c74",
    "source_id": "modelscope-events",
    "title": "蚂蚁灵波具身大模型挑战赛",
    "discovered_url": "https://modelscope.cn/events/367/%E6%AF%94%E8%B5%9B%E4%BB%8B%E7%BB%8D",
    "source_tier": "trusted-platform",
    "first_seen": "2026-09-14",
    "last_seen": "2026-10-11",
    "status": "new",
    "match_reason": [
      "title:挑战赛",
      "url:/events/"
    ]
  },
  {
    "id": "modelscope-events-289fa7fca161ca33",
    "source_id": "modelscope-events",
    "title": "第八届工业互联网大赛",
    "discovered_url": "https://modelscope.cn/events/370/%E6%AF%94%E8%B5%9B%E4%BB%8B%E7%BB%8D",
    "source_tier": "trusted-platform",
    "first_seen": "2026-09-15",
    "last_seen": "2026-09-23",
    "status": "new",
    "match_reason": [
      "title:大赛",
      "url:/events/"
    ]
  },
  {
    "id": "modelscope-events-78cdf91a950a991f",
    "source_id": "modelscope-events",
    "title": "罕见·无界黑客松",
    "discovered_url": "https://modelscope.cn/events/371/%E6%AF%94%E8%B5%9B%E4%BB%8B%E7%BB%8D",
    "source_tier": "trusted-platform",
    "first_seen": "2026-09-15",
    "last_seen": "2026-10-08",
    "status": "new",
    "match_reason": [
      "title:黑客松",
      "url:/events/"
    ]
  },
  {
    "id": "usa-government-challenges-6fabd38e938b30fd",
    "source_id": "usa-government-challenges",
    "title": "Documentation and Decision Support Sprint",
    "discovered_url": "https://www.usa.gov/challenges/documentation-decision-support",
    "source_tier": "official-page",
    "first_seen": "2026-09-16",
    "last_seen": "2026-10-11",
    "status": "new",
    "match_reason": [
      "url:challenge"
    ]
  },
  {
    "id": "usa-government-challenges-7e369487ac50d565",
    "source_id": "usa-government-challenges",
    "title": "NASA's Human Lander Challenge (HuLC)",
    "discovered_url": "https://www.usa.gov/challenges/nasa-human-lander-challenge",
    "source_tier": "official-page",
    "first_seen": "2026-09-22",
    "last_seen": "2026-10-11",
    "status": "new",
    "match_reason": [
      "title:challenge",
      "url:challenge"
    ]
  },
  {
    "id": "usa-government-challenges-cae1403d8bd5b61d",
    "source_id": "usa-government-challenges",
    "title": "DARPA Surgical Competition",
    "discovered_url": "https://www.usa.gov/challenges/darpa-surgical-competition",
    "source_tier": "official-page",
    "first_seen": "2026-09-22",
    "last_seen": "2026-10-11",
    "status": "new",
    "match_reason": [
      "title:competition",
      "url:challenge",
      "url:competition"
    ]
  },
  {
    "id": "modelscope-events-0781888044dcdfd9",
    "source_id": "modelscope-events",
    "title": "西客松｜Shaanxi Hackathon",
    "discovered_url": "https://modelscope.cn/events/376/%E6%AF%94%E8%B5%9B%E4%BB%8B%E7%BB%8D",
    "source_tier": "trusted-platform",
    "first_seen": "2026-09-24",
    "last_seen": "2026-10-08",
    "status": "new",
    "match_reason": [
      "title:Hackathon",
      "url:/events/"
    ]
  },
  {
    "id": "nasa-prizes-challenges-815f9d86aa2d6a3f",
    "source_id": "nasa-prizes-challenges",
    "title": "NASA Unveils Winning Designs for Mars Space Food Systems Challenge",
    "discovered_url": "https://www.nasa.gov/directorates/stmd/prizes-challenges-crowdsourcing-program/centennial-challenges/nasa-unveils-winning-designs-for-mars-space-food-systems-challenge/",